<?xml version="1.0" encoding="UTF-8" standalone="no"?>
<!DOCTYPE plugin SYSTEM "http://www.phamm.org/DTD/phamm-plugins.dtd">

<plugin name="person">
	<label>PERSON</label>
	<version>
		<number>0.0.3</number>
		<creationDate>2006-05-25</creationDate>
		<updatedDate>2008-09-08</updatedDate>
		<status>beta</status>
	</version>
	<author>
		<firstName>Alessandro De Zorzi</firstName>
		<lastName>De Zorzi</lastName>
		<mail>team@phamm.org</mail>
		<web>http://www.phamm.org</web>
	</author>
	<license>GPL</license>
	<shortDescription>RFC2798: Internet Organizational Person</shortDescription>
	<longDescription>RFC2798: Internet Organizational Person</longDescription>
	<parent>top</parent>
	<color>FF4455</color>
	<minAuthLevel>10</minAuthLevel>
	<isDomainRelated>0</isDomainRelated>
	<isPostmasterRelated>0</isPostmasterRelated>
	<isAccountRelated>1</isAccountRelated>
	
	<account>
		<objectClasses>
			<objectClass name="inetOrgPerson">
				<bug>0</bug>
			</objectClass>
		</objectClasses>
		<attributes>
			<attribute name="telephoneNumber">
				<prettyName>Telephone</prettyName>
				<table>1</table>
			</attribute>
			<attribute name="homePhone">
				<prettyName>Home Phone</prettyName>
				<table>1</table>
			</attribute>
			<attribute name="mobile">
				<prettyName>Mobile</prettyName>
				<table>1</table>
			</attribute>
			<attribute name="facsimileTelephoneNumber">
				<prettyName>FAX</prettyName>
				<table>1</table>
			</attribute>
			<attribute name="pager">
				<prettyName>Pager</prettyName>
				<table>1</table>
			</attribute>
		</attributes>
	</account>
</plugin>
